{
    "id": {
      "uri": "at://did:plc:gssjrx12z2xtqa7gl2rny3nm/app.bsky.feed.post/3lbcqs9nsnc2a",
      "cid": "bafybahfjnjjypu6ewy5iryvnm2nu3jwiajscbifi2dtgab7ogutkoi2caa"
    },
    "text": "User post in plain text here",
    "langs": [
      "en"
    ],
    "createdAt": 1732030120973,
    "author": {
      "handle": "username.bsky.social",
      "displayName": "User Name",
      "avatar": "https://cdn.bsky.app/img/avatar/plain/did:plc:gssjrx67z2hfkds7gl3rny3nm/bafkreiebwqcuhgfdjksuhy5wbwfn3by35oa77hwkagm3fliksrnuow2phoz1@jpeg"
    }
}